{
  "$schema": "http://json-schema.org/draft-07/schema#",
  "title": "Make It Real Blueprint Review Artifact",
  "description": "Schema for blueprint-review.json, the approval evidence that binds a reviewed Blueprint fingerprint to a run packet.",
  "type": "object",
  "required": [
    "blueprintFingerprint",
    "decisionNote",
    "prdId",
    "reviewedAt",
    "reviewedBy",
    "reviewSource",
    "runId",
    "schemaVersion",
    "status",
    "workItemId"
  ],
  "properties": {
    "schemaVersion": {
      "description": "Artifact schema version emitted by the Make It Real planner.",
      "type": "string",
      "const": "1.0"
    },
    "runId": {
      "description": "Run packet identifier covered by the review.",
      "type": "string",
      "minLength": 1
    },
    "workItemId": {
      "description": "Primary work item covered by the review.",
      "type": "string",
      "minLength": 1
    },
    "prdId": {
      "description": "PRD identifier covered by the review.",
      "type": "string",
      "minLength": 1
    },
    "blueprintFingerprint": {
      "description": "Fingerprint of the approved or pending Blueprint artifact set.",
      "type": "string",
      "pattern": "^sha256:[0-9a-f]{64}$"
    },
    "status": {
      "description": "Human Blueprint review decision state.",
      "type": "string",
      "enum": [
        "pending",
        "approved",
        "rejected"
      ]
    },
    "reviewSource": {
      "description": "Command or review channel that produced this review record.",
      "type": "string",
      "minLength": 1
    },
    "reviewedBy": {
      "description": "Reviewer identity, or null before a decision is made.",
      "type": [
        "string",
        "null"
      ]
    },
    "reviewedAt": {
      "description": "ISO timestamp for the decision, or null while review is pending.",
      "type": [
        "string",
        "null"
      ]
    },
    "decisionNote": {
      "description": "Optional reviewer note explaining the decision or requested revision.",
      "type": [
        "string",
        "null"
      ]
    }
  },
  "additionalProperties": false
}
