{
  "blueprintFingerprint": "sha256:777752941305a712bbb8677358367562d448c3ac8b4802fe4c422754e87bc330",
  "decisionNote": null,
  "prdId": "prd.auth-kanban",
  "reviewedAt": "2026-05-18T00:00:00.000Z",
  "reviewedBy": "operator:fixture",
  "reviewSource": "makeitreal:plan approve",
  "runId": "board",
  "schemaVersion": "1.0",
  "status": "approved",
  "workItemId": "work.login-ui"
}
